{"active_handoff_ids":[],"captured_at":"2026-07-18T19:34:45Z","schema_version":1,"source":"repository-active-handoff-ledger","withdrawn_handoff_ids":["handoff-07bbe55bc7552489cd55","handoff-56097be57a37a63c7644","handoff-6ed312ee18b254cb3c13","handoff-80d8cb2c06104fcf3c74","handoff-b8d9d535604e78551423","handoff-bc6d14adc7f50224591e","handoff-be908ee37a9b5beba0b5"]}
